{
  "benchmark_id": "task-001-small-v1",
  "code_revision": "4225d2eceb4024d216c476b5c02561851eadae24",
  "config_sha256": "b785a53f692e6cbc0701ee55f5fdbe56c8e8df1ef8768cc01141556f688c5c02",
  "created_at": "2026-09-13T12:24:02Z",
  "generator_revision": "task-001-delayed-symbol-v1",
  "protocol": {
    "benchmark_id": "task-001-small-v1",
    "execution": {
      "batch_size": 64,
      "deterministic_mode": true,
      "device_requested": "cpu",
      "precision": "float32",
      "warmup_sequences": 64
    },
    "generator": {
      "delay": 8,
      "input_size": 1,
      "sequence_length": 64,
      "symbols": [
        -1.0,
        1.0
      ],
      "version": "task-001-delayed-symbol-v1"
    },
    "model": {
      "classifier": "linear",
      "gate_bias_init": 0.0,
      "hidden_size": 16
    },
    "seeds": {
      "canonical": [
        101,
        202,
        303
      ],
      "derivation": "sha256('{root_seed}:{stream}')[:8] interpreted as an unsigned big-endian integer",
      "streams": [
        "model_init",
        "train_data",
        "validation_data",
        "test_data",
        "dataloader"
      ]
    },
    "splits": {
      "test_sequences": 512,
      "train_sequences": 2048,
      "validation_sequences": 512
    },
    "training": {
      "epochs_max": 20,
      "learning_rate": 0.01,
      "optimizer": "adam",
      "selection_metric": "validation_binary_cross_entropy"
    },
    "version": 1
  },
  "seed": 101,
  "streams": {
    "dataloader": 4878869161163140117,
    "model_init": 6760236540965072320,
    "test_data": 194407365973591347,
    "train_data": 18356836755702023849,
    "validation_data": 11186615690728119100
  },
  "system_id": "mymacdeMac-mini.local",
  "version": 1
}
